{
  "$schema": "../../schemas/world-pack.schema.json",
  "schemaVersion": 1,
  "id": "art-deco-city-pack",
  "version": 1,
  "sourceRoot": "assets",
  "compatibility": { "provides": ["urban", "night", "historical", "art-deco", "elevated-transit"] },
  "style": {
    "guide": "style-guide.png",
    "palette": { "sky": 530219, "shadow": 658450, "navy": 1122102, "teal": 1589053, "burgundy": 5906220, "brass": 13017435, "amber": 15910509 },
    "outline": { "color": 658450, "relativeWeight": 0.01 },
    "detail": "medium",
    "groundAnchor": "bottom-center"
  },
  "assets": [
    { "id": "adc-sky", "file": "sky.png", "role": "sky", "opaque": true, "prepare": { "seamWidth": 64 } },
    { "id": "adc-city", "file": "city.png", "role": "mid-background", "prepare": { "trim": true, "height": 420, "cleanEdge": 1, "seamWidth": 64 } },
    { "id": "adc-street", "file": "street.png", "role": "street", "opaque": true, "prepare": { "height": 260, "seamWidth": 48 } },
    { "id": "adc-movie-palace", "file": "movie-palace.png", "role": "architecture", "prepare": { "trim": true, "height": 760, "cleanEdge": 1 } },
    { "id": "adc-department-store", "file": "department-store.png", "role": "architecture", "prepare": { "trim": true, "height": 560, "cleanEdge": 1 } },
    { "id": "adc-bank", "file": "bank.png", "role": "architecture", "prepare": { "trim": true, "height": 640, "cleanEdge": 1 } },
    { "id": "adc-jazz-club", "file": "jazz-club.png", "role": "architecture", "prepare": { "trim": true, "height": 560, "cleanEdge": 1 } },
    { "id": "adc-hotel", "file": "hotel.png", "role": "architecture", "prepare": { "trim": true, "height": 720, "cleanEdge": 1 } },
    { "id": "adc-apartments", "file": "apartments.png", "role": "architecture", "prepare": { "trim": true, "height": 620, "cleanEdge": 1 } },
    { "id": "adc-terminal", "file": "terminal.png", "role": "architecture", "prepare": { "trim": true, "height": 480, "cleanEdge": 1 } },
    { "id": "adc-civic-hall", "file": "civic-hall.png", "role": "architecture", "prepare": { "trim": true, "height": 660, "cleanEdge": 1 } },
    { "id": "adc-sedan", "file": "sedan.png", "role": "vehicle", "prepare": { "trim": true, "height": 118, "cleanEdge": 1 } },
    { "id": "adc-taxi", "file": "taxi.png", "role": "vehicle", "prepare": { "trim": true, "height": 110, "cleanEdge": 1 } },
    { "id": "adc-elevated-train", "file": "elevated-train.png", "role": "vehicle", "prepare": { "trim": true, "height": 130, "cleanEdge": 1 } },
    { "id": "adc-zeppelin", "file": "zeppelin.png", "role": "ambient-flight", "prepare": { "trim": true, "height": 105, "cleanEdge": 1 } },
    { "id": "adc-woman", "file": "woman.png", "role": "inhabitant", "prepare": { "trim": true, "height": 100, "cleanEdge": 1 } },
    { "id": "adc-man", "file": "man.png", "role": "inhabitant", "prepare": { "trim": true, "height": 100, "cleanEdge": 1 } },
    { "id": "adc-street-lamp", "file": "street-lamp.png", "role": "street-prop", "prepare": { "trim": true, "height": 168, "cleanEdge": 1 } },
    { "id": "adc-newsstand", "file": "newsstand.png", "role": "street-prop", "prepare": { "trim": true, "height": 150, "cleanEdge": 1 } },
    { "id": "adc-rooftop-sentinel", "file": "rooftop-sentinel.png", "role": "rare-event", "prepare": { "trim": true, "height": 126, "cleanEdge": 1 } },
    { "id": "adc-night-signal", "file": "night-signal.png", "role": "rare-event", "prepare": { "trim": true, "height": 260, "cleanEdge": 1 } }
  ],
  "recipes": [
    { "id": "movie-palace", "asset": "adc-movie-palace", "role": "landmark", "anchor": { "x": 0.5, "y": 1 }, "tags": ["architecture", "grounded"] },
    { "id": "department-store", "asset": "adc-department-store", "role": "building", "anchor": { "x": 0.5, "y": 1 }, "tags": ["architecture", "grounded"] },
    { "id": "bank", "asset": "adc-bank", "role": "building", "anchor": { "x": 0.5, "y": 1 }, "tags": ["architecture", "grounded"] },
    { "id": "jazz-club", "asset": "adc-jazz-club", "role": "building", "anchor": { "x": 0.5, "y": 1 }, "tags": ["architecture", "grounded"] },
    { "id": "hotel", "asset": "adc-hotel", "role": "building", "anchor": { "x": 0.5, "y": 1 }, "tags": ["architecture", "grounded"] },
    { "id": "apartments", "asset": "adc-apartments", "role": "building", "anchor": { "x": 0.5, "y": 1 }, "tags": ["architecture", "grounded"] },
    { "id": "terminal", "asset": "adc-terminal", "role": "building", "anchor": { "x": 0.5, "y": 1 }, "tags": ["architecture", "grounded"] },
    { "id": "civic-hall", "asset": "adc-civic-hall", "role": "building", "anchor": { "x": 0.5, "y": 1 }, "tags": ["architecture", "grounded"] },
    { "id": "woman", "asset": "adc-woman", "role": "inhabitant", "anchor": { "x": 0.5, "y": 1 }, "worldHeight": 100, "tags": ["grounded", "stationary"] },
    { "id": "man", "asset": "adc-man", "role": "inhabitant", "anchor": { "x": 0.5, "y": 1 }, "worldHeight": 100, "tags": ["grounded", "stationary"] },
    { "id": "sedan", "asset": "adc-sedan", "role": "traffic", "anchor": { "x": 0.5, "y": 1 }, "directions": ["left"], "tags": ["grounded", "street", "near-lane"] },
    { "id": "taxi", "asset": "adc-taxi", "role": "traffic", "anchor": { "x": 0.5, "y": 1 }, "directions": ["right"], "tags": ["grounded", "street", "far-lane"] },
    { "id": "elevated-train", "asset": "adc-elevated-train", "role": "ambient-traffic", "anchor": { "x": 0.5, "y": 1 }, "directions": ["right"], "tags": ["airborne", "transit"] },
    { "id": "zeppelin", "asset": "adc-zeppelin", "role": "ambient-traffic", "anchor": { "x": 0.5, "y": 0.5 }, "directions": ["left"], "tags": ["airborne", "rare-event"] },
    { "id": "rooftop-sentinel", "asset": "adc-rooftop-sentinel", "role": "rare-event", "anchor": { "x": 0.5, "y": 1 }, "tags": ["stationary", "rare-event"] },
    { "id": "night-signal", "asset": "adc-night-signal", "role": "rare-event", "anchor": { "x": 0.5, "y": 0.5 }, "tags": ["stationary", "rare-event"] }
  ]
}
